input,output
correct: گلوکار نے اپنی اپنی آواز سے محفل کو مسحور کر دیا,گلوکار نے اپنی آواز سے محفل کو مسحور کر دیا
correct: میں کی دو گھنٹے ریاضی روزانہ مشق کرتا ہوں,میں روزانہ دو گھنٹے ریاضی کی مشق کرتا ہوں
correct: ہم نے فیصلہ کیا پروجیکٹ پر کل,ہم نے کل پروجیکٹ پر فیصلہ کیا
correct: وادی میں موسم بہت بہت خوشگوار تھا,وادی میں موسم بہت خوشگوار تھا
correct: میں نے موبائل چارج کیا اور چارجنگ لگائی,میں نے موبائل چارج کیا
correct: ادبی تقریب میں ملک بھر ادیب شریک ہوئے,ادبی تقریب میں ملک بھر کے ادیب شریک ہوئے
correct: میں نے رات کو بہت دیر تک موبائل استعمال کیا تھا اور سویا تھا دیر سے,میں نے رات کو بہت دیر تک موبائل استعمال کیا اور دیر سے سویا
correct: میری بہن نے خانہ صاف کیا اور گھر صاف کیا,میری بہن نے گھر صاف کیا
correct: کھیلتا رہا باہر وہ دوپہر تک,وہ دوپہر تک باہر کھیلتا رہا
correct: یونیورسٹی نے تحقیقی منصوبوں جاری کیے کے لیے فنڈز,یونیورسٹی نے تحقیقی منصوبوں کے لیے فنڈز جاری کیے
correct: میں نے سمجھا مشکل سبق بہت غور سے,میں نے بہت غور سے مشکل سبق سمجھا
correct: کوچ نے نے کھلاڑیوں کو نئی حکمت عملی سمجھائی,کوچ نے کھلاڑیوں کو نئی حکمت عملی سمجھائی
correct: محکمہ تعلیم نے نئے امتحانی شیڈول کا کا اعلان کیا,محکمہ تعلیم نے نئے امتحانی شیڈول کا اعلان کیا
correct: عالمی بینک نے نئی رپورٹ جاری کی ہے جو کہ اہم ہے,عالمی بینک نے نئی رپورٹ جاری کی
correct: امی نے سویاں پر میٹھی عید پکائیں,امی نے عید پر میٹھی سویاں پکائیں
correct: رات دیر تک جاگا وہ کام کر کے,وہ کام کر کے رات دیر تک جاگا
correct: بہن شام کی چائے کے ساتھ سموسے بنائے,بہن نے شام کی چائے کے ساتھ سموسے بنائے
correct: میرے ابو نے پیسے دیے اور رقم دی,میرے ابو نے پیسے دیے
correct: پاکستان نے معاہدہ کیا ہیں,پاکستان نے معاہدہ کیا ہے
correct: ہم نے جنریٹو اے آئی کورس میں کوڈ لکھا اور پھر ہم نے اس کو چلایا,ہم نے جنریٹو اے آئی کورس میں کوڈ لکھا اور پھر اسے چلایا
correct: انتخابی مہم میں تمام جماعتیں بڑھ چڑھ کر حصہ لے رہی ہیں ہیں,انتخابی مہم میں تمام جماعتیں بڑھ چڑھ کر حصہ لے رہی ہیں
correct: انتخابی مہم میں تمام جماعتیں رہی ہیں بڑھ چڑھ کر حصہ لے,انتخابی مہم میں تمام جماعتیں بڑھ چڑھ کر حصہ لے رہی ہیں
correct: یہ تحقیق انسان جسم سمجھنے مدد دیتی,یہ تحقیق انسانی جسم کو سمجھنے میں مدد دیتی ہے
correct: گاہکوں کی سہولت کے لیے دکان رات نو بجے تک کھلی رہتی ہیں,گاہکوں کی سہولت کے لیے دکان رات نو بجے تک کھلی رہتی ہے
correct: مقامی لوگوں نے نے سیاحوں کا گرمجوشی سے استقبال کیا,مقامی لوگوں نے سیاحوں کا گرمجوشی سے استقبال کیا
correct: آج میں نے بہت اچھا کھانا کھایا گھر میں,آج میں نے گھر میں بہت اچھا کھانا کھایا
correct: تھیٹر میں بیٹھے تھے لوگ خاموشی سے ڈراما شروع ہونے تک,لوگ تھیٹر میں ڈراما شروع ہونے تک خاموشی سے بیٹھے تھے
correct: قہوہ پینے سے طبیعت طبیعت تروتازہ ہو جاتی ہے,قہوہ پینے سے طبیعت تروتازہ ہو جاتی ہے
correct: وادی دلچسپ تھی کیلاش کی ثقافت بہت منفرد اور,وادی کیلاش کی ثقافت بہت منفرد اور دلچسپ تھی
correct: خود اپنے کپڑے وہ دھوتی ہے,وہ اپنے کپڑے خود دھوتی ہے
correct: ثقافتی میلے میں سٹال لگے مختلف صوبوں کے دستکاری,ثقافتی میلے میں مختلف صوبوں کے دستکاری سٹال لگے
correct: سیاحوں نے قدیم کھنڈرات کا دورہ کیا شہر کے باہر,سیاحوں نے شہر کے باہر قدیم کھنڈرات کا دورہ کیا
correct: میرا بیٹی نے گانا گایا,میری بیٹی نے گانا گایا
correct: ڈاکٹر نے علاج شروع کیا اور مریض بہتر ہو گیا جلدی,ڈاکٹر نے علاج شروع کیا اور مریض جلدی بہتر ہو گیا
correct: ہم نے کل شام کلاسیکی موسیقی کی محفل میں روح پرور دھنیں سنیں,ہم نے کل شام کلاسیکی موسیقی کی محفل میں دھنیں سنیں
correct: کیا محنت بہت کھلاڑی نے جیت کے لیے,کھلاڑی نے جیت کے لیے بہت محنت کی
correct: وہ صبح مسجد سے واپس آ کر قرآن پڑھتا ہیں,وہ صبح مسجد سے واپس آ کر قرآن پڑھتا ہے
correct: آج صبح بادل چھائے رہی,آج صبح بادل چھائے رہے
correct: کمپنی معاہدے کیے نے سپلائرز کے ساتھ نئے,کمپنی نے سپلائرز کے ساتھ نئے معاہدے کیے
correct: کھانے میں میں دہی کا رائتہ بہت اچھا لگتا ہے,کھانے میں دہی کا رائتہ بہت اچھا لگتا ہے
correct: ٹی شروع کیا وی چینل نے نیا تفریحی شو,ٹی وی چینل نے نیا تفریحی شو شروع کیا
correct: شاعرہ نے اپنی نئی غزل بہت نرم اور خوبصورت آواز میں سنائی,شاعرہ نے اپنی نئی غزل نرم اور خوبصورت آواز میں سنائی
correct: وہ کہتہا ہے کہ کل آئے گا,وہ کہتا ہے کہ کل آئے گا
correct: عدالت نے اہم مقدمے کا فیصلہ محفوظ کر لیاا,عدالت نے اہم مقدمے کا فیصلہ محفوظ کر لیا
correct: آج رات کو ہم کھانا کھائیں گے باہر,آج رات ہم باہر کھانا کھائیں گے
correct: مجھے دوائ لینی ہے,مجھے دوائی لینی ہے
correct: غزہ میں شدید بمباری ہو رہی ہیں,غزہ میں شدید بمباری ہو رہی ہے
correct: وہ کو شام روزانہ پارک میں سیر کرنے جاتا ہے,وہ روزانہ شام کو پارک میں سیر کرنے جاتا ہے
correct: میں نے لیکچر سنا تھا اور پھر میں نے نوٹس بھی بنائے تھے اس کے,میں نے لیکچر سنا اور نوٹس بنائے
correct: ٹیم نے پروجیکٹ کا کا تجزیہ کیا,ٹیم نے پروجیکٹ کا تجزیہ کیا
correct: وہ روز بہت تیز دوڑتا ہے اور کھیلتا ہیں,وہ روز بہت تیز دوڑتا ہے اور کھیلتا ہے
correct: طلبہ حصہ لیا نے گروپ ڈسکشن میں بڑھ چڑھ کر,طلبہ نے گروپ ڈسکشن میں بڑھ چڑھ کر حصہ لیا
correct: فنانس ڈیپارٹمنٹ نے ماہانہ رپورٹ تیار کر لی لی,فنانس ڈیپارٹمنٹ نے ماہانہ رپورٹ تیار کر لی
correct: میں میں نے کل کل بہت زیادہ زیادہ کھایا,میں نے کل بہت زیادہ کھایا
correct: ہوٹل کے کمرے کرایہ بہت مناسب تھا,ہوٹل کے کمرے کا کرایہ بہت مناسب تھا
correct: کالج کی سالانہ کھیلوں کی تقریب کا افتتاح ہو گئی,کالج کی سالانہ کھیلوں کی تقریب کا افتتاح ہو گیا
correct: تماشائیوں نے کیا شور بہت میچ کے دوران,تماشائیوں نے میچ کے دوران بہت شور کیا
correct: براہ کرم مجھے یہ بتائیں کہ مجھے اگلے مرحلے کے لیے کیا کرنا چاہیے اب,براہ کرم بتائیں کہ مجھے اگلے مرحلے کے لیے کیا کرنا چاہیے
correct: وہ صبح جلدی اٹھ اٹھ کر ناشتا تیار کرتی ہے,وہ صبح جلدی اٹھ کر ناشتا تیار کرتی ہے
correct: ٹیم نے وقت پر کام مکمل کیا ہے کل,ٹیم نے کل وقت پر کام مکمل کیا
correct: اس مشین کو چلانے کا طریقہ بہت آسان ہیں,اس مشین کو چلانے کا طریقہ بہت آسان ہے
correct: عید کیا گیا کے موقع پر خصوصی ڈرامہ پیش,عید کے موقع پر خصوصی ڈرامہ پیش کیا گیا
correct: مقامی لوگوں نے سیاحوں کا گرمجوشی استقبال کیا,مقامی لوگوں نے سیاحوں کا گرمجوشی سے استقبال کیا
correct: وہ روز صبح چائے پیتا ہے چائے نوشی کرتا ہے,وہ روز صبح چائے پیتا ہے
correct: میچ دلچسپ تھا اور تماشائی خوش,میچ دلچسپ تھا اور تماشائی خوش تھے
correct: آن لائن آرڈر کرنے پر مفت مفت ڈیلیوری کی سہولت ہے,آن لائن آرڈر کرنے پر مفت ڈیلیوری کی سہولت ہے
correct: اقوام متحدہ نے بلایا اجلاس,اقوام متحدہ نے اجلاس بلایا
correct: وہ عید لیے نئے کپڑے لینے بازار گئی,وہ عید کے لیے نئے کپڑے لینے بازار گئی
correct: آج آج موسم موسم بہت اچھا ہے,آج موسم بہت اچھا ہے
correct: وہ لوگ خوش ہے اپنی کامیابی پر,وہ لوگ اپنی کامیابی پر خوش ہیں
correct: کمپنی نے سالانہ جائزہ میٹنگ کا اعلان کر دیا دیا,کمپنی نے سالانہ جائزہ میٹنگ کا اعلان کر دیا
correct: بچوں نے دوپہر میں میں اپنا ہوم ورک مکمل کر لیا,بچوں نے دوپہر میں اپنا ہوم ورک مکمل کر لیا
correct: عدالت نے اہم اہم مقدمے کا فیصلہ محفوظ کر لیا,عدالت نے اہم مقدمے کا فیصلہ محفوظ کر لیا
correct: میں کی کلاس حیاتیات خلیے کی ساخت پڑھائی گئی,حیاتیات کی کلاس میں خلیے کی ساخت پڑھائی گئی
correct: مجھے آج ڈاکٹر کے پاس جانا ہے جانا ہے,مجھے آج ڈاکٹر کے پاس جانا ہے
correct: ہو رہا ہے ٹورنامنٹ جاری شہر میں,شہر میں ٹورنامنٹ جاری ہو رہا ہے
correct: گاہک نے پراڈکٹ کے بارے میں رائے دی دی,گاہک نے پراڈکٹ کے بارے میں رائے دی
correct: نئی اینیمیشن فلم بچوں میں بہت مقبول ہوا,نئی اینیمیشن فلم بچوں میں بہت مقبول ہوئی
correct: کر خانے نے ویزا کی درخواست منظور سفارت لی,سفارت خانے نے ویزا کی درخواست منظور کر لی
correct: یہ نمائش بہت شاندار تھے,یہ نمائش بہت شاندار تھی
correct: ہم نے امتحان دیا اور اس کا نتیجہ اچھا آئے,ہم نے امتحان دیا اور اس کا نتیجہ اچھا آیا
correct: طلبہ کو لائبریری میں جا کر حوالہ جاتی کتب کہا گیا دیکھنے کا,طلبہ کو لائبریری میں جا کر حوالہ جاتی کتب دیکھنے کا کہا گیا
correct: مریض کو فزیوتھراپی مشورہ دیا گیا,مریض کو فزیوتھراپی کا مشورہ دیا گیا
correct: میں نے دیکھا فلم دوست ساتھ,میں نے دوست کے ساتھ فلم دیکھی
correct: ہم نے دفتر میں نئے سسٹم کی انسٹالیشن مکمل کی کامیابی سے,ہم نے دفتر میں نئے سسٹم کی انسٹالیشن کامیابی سے مکمل کی
correct: ادیب نے بیان کی انسانی جذبات کی کہانی خوبصورتی سے,ادیب نے انسانی جذبات کی کہانی خوبصورتی سے بیان کی
correct: پروڈکشن ٹیم تیار کیا نے نئے پراڈکٹ کا پہلا نمونہ,پروڈکشن ٹیم نے نئے پراڈکٹ کا پہلا نمونہ تیار کیا
correct: میں نے کل ایک مشہور افسانہ پڑھی,میں نے کل ایک مشہور افسانہ پڑھا
correct: فٹ بالر بالر نے خوبصورت گول کیا,فٹ بالر نے خوبصورت گول کیا
correct: ہوائی جہاز نے وقت پرواز بھری پر,ہوائی جہاز نے وقت پر پرواز بھری
correct: وزیر خارجہ نے کیا دورہ,وزیر خارجہ نے دورہ کیا
correct: عید کے موقع پر خصوصی ڈرامہ پیش کیا گیا گیا,عید کے موقع پر خصوصی ڈرامہ پیش کیا گیا
correct: فلسطین میں بڑھ رہی ہے انسانی بحران,فلسطین میں انسانی بحران بڑھ رہی ہے
correct: ہم نے رپورٹ تیار کیا ہے,ہم نے رپورٹ تیار کی ہے
correct: سفارت خانے درخواست ویزا کی نے منظور کر لی,سفارت خانے نے ویزا کی درخواست منظور کر لی
correct: فلم کی ہدایت کاری میں تخلیقی جدت اور فنی مہارت نمایاں تھی,فلم کی ہدایت کاری میں مہارت نمایاں تھی
correct: فائلیں صحیح طریقے سے ترتیب دیا گیا ہے,فائلیں صحیح طریقے سے ترتیب دی گئی ہیں
correct: سیاحوں نے دریا کے کنارے بیٹھا تھا,سیاح دریا کے کنارے بیٹھے تھے
correct: میں جمع دفتر میں حاضر ہو کر رپورٹ کل کرا دوں گا,میں کل دفتر میں حاضر ہو کر رپورٹ جمع کرا دوں گا
correct: میں نے دوا لی ڈاکٹر کی ہدایت کے مطابق صبح,میں نے ڈاکٹر کی ہدایت کے مطابق صبح دوا لی
correct: وہ گھر سے نکلا اور سڑک پر چلی گئی,وہ گھر سے نکلا اور سڑک پر چلا گیا
correct: لیجنڈ اداکار نے تھیٹر تھیٹر میں شاندار پرفارمنس دی,لیجنڈ اداکار نے تھیٹر میں شاندار پرفارمنس دی
correct: امی سویاں پکائیں نے عید پر میٹھی,امی نے عید پر میٹھی سویاں پکائیں
correct: میں نے آرٹ گیلری میں بہت خوبصورت اور جدید پینٹنگز دیکھیں,میں نے آرٹ گیلری میں خوبصورت جدید پینٹنگز دیکھیں
correct: ہم نے آن لائن شاپنگ شاپنگ ویب سائٹ سے کتابیں منگوائیں,ہم نے آن لائن شاپنگ ویب سائٹ سے کتابیں منگوائیں
correct: یہ موبائل موبائل فون بہترین بیٹری لائف رکھتا ہے,یہ موبائل فون بہترین بیٹری لائف رکھتا ہے
correct: وہ روز اسکول جاتی ہے اور پڑھتا ہے,وہ روز اسکول جاتی ہے اور پڑھتی ہے
correct: میں نے ایگزام کی تیاری کی اور تیاری کی,میں نے ایگزام کی تیاری کی
correct: مقامی بازار سے تحائف خریدے ہم نے,مقامی بازار سے ہم نے تحائف خریدے
correct: شاعرہ نے غزل بہت خوبصورت انداز پیش کی,شاعرہ نے غزل کو بہت خوبصورت انداز میں پیش کی
correct: آن لائن لائن آرڈر کرنے پر مفت ڈیلیوری کی سہولت ہے,آن لائن آرڈر کرنے پر مفت ڈیلیوری کی سہولت ہے
correct: کرکٹر نے سینچری مدد کی بنا کر میچ جتوانے میں,کرکٹر نے سینچری بنا کر میچ جتوانے میں مدد کی
correct: ایمیزون پرائم کے ممبران کو مفت ملتی ہے ڈیلیوری,ایمیزون پرائم کے ممبران کو مفت ڈیلیوری ملتی ہے
correct: کتاب میلہ لگا اسلام آباد میں بڑا,اسلام آباد میں بڑا کتاب میلہ لگا
correct: چائے پیو گرم ہے ابھی,ابھی گرم چائے پیو
correct: لیبارٹری میں طلبہ نے کیمیکل تجربہ کیا کیا,لیبارٹری میں طلبہ نے کیمیکل تجربہ کیا
correct: بھانجے نے کیا فون مجھے رات کو,بھانجے نے رات کو مجھے فون کیا
correct کھلاڑی روزانہ صبح سویرے اٹھ کر ٹریننگ کرتا ہے جو اس کی فٹنس کے لیے بہت اچھا ہے,کھلاڑی روزانہ صبح سویرے ٹریننگ کرتا ہے
correct: ریویو لکھا نئے ناول کا نقاد نے,نقاد نے نئے ناول کا ریویو لکھا
correct: آج موسم بہت ٹھنڈ باہر,آج موسم باہر بہت ٹھنڈا ہے
correct: ٹیم نے کام کیا ہے اور مکمل تھا,ٹیم نے کام کیا ہے اور مکمل کیا ہے
correct: عید کے موقع پر خصوصی ڈرامہ پیش پیش کیا گیا,عید کے موقع پر خصوصی ڈرامہ پیش کیا گیا
correct: وہ لوگ موسیقی کے پروگرام میں گیا تھا,وہ لوگ موسیقی کے پروگرام میں گئے تھے
correct: آج گھر میں مہمان آئے اچانک,آج اچانک گھر میں مہمان آ گئے
correct: سیاحوں نے جھیل کے کنارے تصاویر بنائیں خوبصورت یادگار,سیاحوں نے جھیل کے کنارے خوبصورت یادگار تصاویر بنائیں
correct: مقابلے میں شرکت کے لیے روانہ ہوگی ٹیم کل,مقابلے میں شرکت کے لیے ٹیم کل روانہ ہوگی
correct: چکن کڑاہی کے ساتھ خمیری روٹی روٹی بہترین تھی,چکن کڑاہی کے ساتھ خمیری روٹی بہترین تھی
correct: مہمانوں کے لیے لیے قورمہ اور نان کا اہتمام کیا گیا,مہمانوں کے لیے قورمہ اور نان کا اہتمام کیا گیا
correct: ہم نے سفر پہاڑوں میں خوبصورت نظارہ کیا,ہم نے سفر کے دوران پہاڑوں میں خوبصورت نظارہ کیا
correct: وہ شادی کر لی اور نکاح ہو گیا,اس کی شادی ہو گئی
correct: بس میں ہم تھے اور سفر بہت لمبا تھا تھکا دینے والا,ہم بس میں تھے اور سفر بہت لمبا اور تھکا دینے والا تھا
correct: وہ پہاڑوں چوٹی تک ٹریکنگ کر کے گیا,وہ پہاڑوں کی چوٹی تک ٹریکنگ کر کے گیا
correct: جھیل کے اور کا رنگ نیلا پانی صاف تھا,جھیل کے پانی کا رنگ نیلا اور صاف تھا
correct: ڈاکٹر نے مریض کی مکمل رپورٹ لکھی لکھی,ڈاکٹر نے مریض کی مکمل رپورٹ لکھی
correct: بھابھی نے نے صحن میں رنگولی بنائی,بھابھی نے صحن میں رنگولی بنائی
correct: گلوکارہ نے اپنی نئی البم کے تمام گانے بہت خوبصورت انداز میں ریکارڈ کیے ہیں,گلوکارہ نے اپنی نئی البم کے گانے خوبصورت انداز میں ریکارڈ کیے ہیں
correct: ہم نے چائے اور بسکٹ کھایا,ہم نے چائے اور بسکٹ کھائے
correct: مریض کو اسپتال فوری منتقل کیا گیا,مریض کو اسپتال میں فوری منتقل کیا گیا
correct: سالن لیموں کا رس ڈالنے سے ذائقہ بڑھ جاتا ہے,سالن میں لیموں کا رس ڈالنے سے ذائقہ بڑھ جاتا ہے
correct: وزیر صحت نے ہسپتالوں کی حالت حالت بہتر بنانے کا وعدہ کیا,وزیر صحت نے ہسپتالوں کی حالت بہتر بنانے کا وعدہ کیا
correct: ٹورنمنٹ میں حصہ لیا,ٹورنامنٹ میں حصہ لیا
correct: وہ سبح ناشتے میں پراٹھا اور چائے لیتا ہے,وہ صبح ناشتے میں پراٹھا اور چائے لیتا ہے
correct: میں FAST یونیورسٹی میں داخلہ لیا ہے,میں نے FAST یونیورسٹی میں داخلہ لیا ہے
correct: چکن کڑاہی کے کے ساتھ خمیری روٹی بہترین تھی,چکن کڑاہی کے ساتھ خمیری روٹی بہترین تھی
correct: دیکھ رہے ہیں سب فائنل میچ ٹی وی پر,سب ٹی وی پر فائنل میچ دیکھ رہے ہیں
correct: طلبہ نے کیا سوالات استاد سے کلاس میں,طلبہ نے کلاس میں استاد سے سوالات کیے
correct: FAST یونیورسٹی میں کلاسز بہت زیادہ ہوتی ہیں اور ہم بہت تھک جاتے ہیں کبھی,FAST یونیورسٹی میں کلاسز زیادہ ہوتی ہیں اور ہم کبھی کبھی تھک جاتے ہیں
correct: جائزہ نے طلبہ کی کارکردگی کا پرنسپل لیا,پرنسپل نے طلبہ کی کارکردگی کا جائزہ لیا
correct: گلوکار کی آواز تھی جادوئی,گلوکار کی آواز جادوئی تھی
correct: ٹیم نے کل کام مکمل کر لی تھی,ٹیم نے کل کام مکمل کر لیا تھا
correct: پاکستان نے ردعمل دیا ہیں,پاکستان نے ردعمل دیا ہے
correct: ہم نے ڈیٹا اپ ڈیٹ کیا سسٹم,ہم نے سسٹم میں ڈیٹا اپ ڈیٹ کیا
correct: ہم نے ریسرچ کے لیے ڈیٹا اکٹھا کیا اور پھر ہم نے اس کو استعمال کیا,ہم نے ریسرچ کے لیے ڈیٹا اکٹھا کیا اور اسے استعمال کیا
correct: وہ صبح ناشتے لیتا ہے میں پراٹھا اور چائے,وہ صبح ناشتے میں پراٹھا اور چائے لیتا ہے
correct: وہ بچہ رو رہے ہیں,وہ بچہ رو رہا ہے
correct: محکمہ موسمیات نے کر دی بارش کی پیشگوئی,محکمہ موسمیات نے بارش کی پیشگوئی کر دی
correct: نمائش دیکھنے گئے لوگ بہت,لوگ نمائش دیکھنے گئے
correct: تفریحی مقام پر بہت بہت زیادہ رش تھا,تفریحی مقام پر بہت زیادہ رش تھا
correct: چائے کے ساتھ پراٹہا بہت اچھا لگا,چائے کے ساتھ پراٹھا بہت اچھا لگا
correct: ہم نے محکمہ کو تمام دستاویزات فراہم کر دی ہے,ہم نے محکمہ کو تمام دستاویزات فراہم کر دی ہیں
correct: ہمارے گھر درخت ہے کے باہر نیم کا,ہمارے گھر کے باہر نیم کا درخت ہے
correct: نئے لیپ ٹاپ کا پروسیسر بہت تیز تیز رفتار ہے,نئے لیپ ٹاپ کا پروسیسر بہت تیز رفتار ہے
correct: ہم نے کلائنٹ کی ضروریات کے مطابق پروپوزل تیار تیار کیا,ہم نے کلائنٹ کی ضروریات کے مطابق پروپوزل تیار کیا
correct: سالن میں لیموں کا رس ڈالنے سے ذائقہ بڑھ جاتی ہے,سالن میں لیموں کا رس ڈالنے سے ذائقہ بڑھ جاتا ہے
correct: رات کو بجلی جانے کی ہو گیا وجہ سے پنکھا بند,رات کو بجلی جانے کی وجہ سے پنکھا بند ہو گیا
correct: کھیلتے ہیں دوست,دوست کھیلتے ہیں
correct: سیاحوں نے برف پوش سڑکوں پر جیپ کے ذریعے دلچسپ سفر کیا,سیاحوں نے جیپ کے ذریعے برف پوش سڑکوں پر دلچسپ سفر کیا
correct: عدالت نے مقدمے کی اگلی تاریخ مقرر کر دیا,عدالت نے مقدمے کی اگلی تاریخ مقرر کر دی
correct: کباب اتنے نرم تھے کہ منہ میں رکھتے ہی گھل گئی,کباب اتنے نرم تھے کہ منہ میں رکھتے ہی گھل گئے
correct: سفارت کر لی خانے نے ویزا کی درخواست منظور,سفارت خانے نے ویزا کی درخواست منظور کر لی
correct: میں نے ای میل لکھا ہے کلائنٹ کو,میں نے کلائنٹ کو ای میل لکھی ہے
correct: وکیل نے عدالت مؤقف پیش کیا,وکیل نے عدالت میں مؤقف پیش کیا
correct: روزانہ دو گھنٹے ریاضی کی مشق کرتا ہوں,میں روزانہ دو گھنٹے ریاضی کی مشق کرتا ہوں
correct: فلم کی شوٹنگ شمالی میں ہوئی علاقہ جات,فلم کی شوٹنگ شمالی علاقہ جات میں ہوئی
correct: کشن فیسٹیول میں رات بھر موسیقی کی محفل جمی رہا,کشن فیسٹیول میں رات بھر موسیقی کی محفل جمی رہی
