input,output
correct: حکومت نے نئی پابندیاں لگایا ہے,حکومت نے نئی پابندیاں لگائی ہیں
correct: محکمہ موسمیات نے بارش کی پیشگوئی کر کر دی,محکمہ موسمیات نے بارش کی پیشگوئی کر دی
correct: وہ صبح جلدی اٹھ کر کرتی ہے ناشتا تیار,وہ صبح جلدی اٹھ کر ناشتا تیار کرتی ہے
correct: کیا ٹریننگ صبح سویرے کھلاڑی نے,کھلاڑی نے صبح سویرے ٹریننگ کی
correct: انتخابی مہم میں تمام جماعتیں بڑھ چڑھ کر حصہ لے رہی ہے,انتخابی مہم میں تمام جماعتیں بڑھ چڑھ کر حصہ لے رہی ہیں
correct: ایچ آر نے نئے نئے ملازمین کی ٹریننگ کا اہتمام کیا,ایچ آر نے نئے ملازمین کی ٹریننگ کا اہتمام کیا
correct: پولیس تھانے میں درج مقدمے کی تفتیش تیزی سے جاری ہیں,پولیس تھانے میں درج مقدمے کی تفتیش تیزی سے جاری ہے
correct: فزکس کے استاد نے نیوٹن نیوٹن کے قوانین پر لیکچر دیا,فزکس کے استاد نے نیوٹن کے قوانین پر لیکچر دیا
correct: پانی ختم ہو گیا اور پانی نہیں رہا,پانی ختم ہو گیا
correct: یہ فلم اپنی کہانی بہت مشہور ہے,یہ فلم اپنی کہانی کی وجہ سے بہت مشہور ہے
correct: یہ مصور خوبصورت تصویریں بناتا ہیں,یہ مصور خوبصورت تصویریں بناتا ہے
correct: مینیجر نے ہدایت دی ہیں سب کو,مینیجر نے سب کو ہدایت دی ہے
correct: پروفیسر نے کوانٹم کوانٹم فزکس کے اصول سمجھائے,پروفیسر نے کوانٹم فزکس کے اصول سمجھائے
correct: اس نے فون اٹھایا اور بات کریں,اس نے فون اٹھایا اور بات کی
correct: حیاتیات کی کلاس میں خلیے پڑھائی گئی کی ساخت,حیاتیات کی کلاس میں خلیے کی ساخت پڑھائی گئی
correct: ملک میں بڑھ رہی ہے مہنگائی,ملک میں مہنگائی بڑھ رہی ہے
correct: آج گهر سے جلدی نکلنا ہے,آج گھر سے جلدی نکلنا ہے
correct: پرنسپل نے طلبہ کی کارکردگی کا جائزہ لیاا,پرنسپل نے طلبہ کی کارکردگی کا جائزہ لیا
correct: ہم نے پہاڑوں میں برف باری کا بہت زیادہ خوبصورت منظر دیکھا,ہم نے پہاڑوں میں برف باری کا خوبصورت منظر دیکھا
correct: فلم کی شوٹنگ شمالی علاقہ میں ہوئی جات,فلم کی شوٹنگ شمالی علاقہ جات میں ہوئی
correct: میں نے دوست سے ملاقات کیا کل,میں نے کل دوست سے ملاقات کی
correct: گاہکوں کی سہولت کے لیے دکان رات نو نو بجے تک کھلی رہتی ہے,گاہکوں کی سہولت کے لیے دکان رات نو بجے تک کھلی رہتی ہے
correct: ڈاکٹر نے مریض ویکسین لگائی کل,ڈاکٹر نے کل مریض کو ویکسین لگائی
correct: ہم نے کل کل شام ایک کلاسیکی موسیقی کی محفل دیکھی,ہم نے کل شام ایک کلاسیکی موسیقی کی محفل دیکھی
correct: یہ فلم بہت بہت زیادہ تکنیکی طور پر مضبوط اور متاثر کن ہے,یہ فلم تکنیکی طور پر مضبوط اور متاثر کن ہے
correct: میں نے لیا مشورہ دوست سے صحت,میں نے دوست سے صحت کے بارے میں مشورہ لیا
correct: ہاکی ٹیم نے نے فائنل میں جگہ بنا لی,ہاکی ٹیم نے فائنل میں جگہ بنا لی
correct: میں نے لی وٹامن ڈاکٹر کے مشورہ,میں نے ڈاکٹر کے مشورے سے وٹامن لی
correct: ہم نے کل ایک دستاویزی فلم دیکھی جو ثقافتی ورثے کو اجاگر کرتی تھی,ہم نے کل ایک دستاویزی فلم دیکھی
correct: فنانس ٹیم رپورٹ بنا رہا ہے,فنانس ٹیم رپورٹ بنا رہی ہے
correct: وہ چلا آیا واپس بغیر بتائے,وہ بغیر بتائے واپس چلا آیا
correct: بچے خوش ہیں اور ہنس رہے ہیں مسکرا رہے ہیں,بچے خوش ہیں اور ہنس رہے ہیں
correct: چین کی طرف سے نئی پالیسی کا اعلان کر دیا گیا,چین نے نئی پالیسی کا اعلان کیا
correct: شاعر نے اپنی تازہ غزل میں فکری گہرائی اور جمالیاتی حسن کو سمو دیا ہے,شاعر نے اپنی تازہ غزل میں فکری گہرائی کو سمو دیا ہے
correct: جھیل کے پانی کا صاف تھا رنگ نیلا اور,جھیل کے پانی کا رنگ نیلا اور صاف تھا
correct: میں نے تمام ڈیٹا اکٹھا کیا تھا اور پھر میں نے اسے رپورٹ میں شامل کیا تھا ترتیب سے,میں نے تمام ڈیٹا اکٹھا کیا اور اسے ترتیب سے رپورٹ میں شامل کیا
correct: میں نے ایگزام کی تیاری کر رہا تھا کل رات,میں کل رات ایگزام کی تیاری کر رہا تھا
correct: ہم نے ریستوران میں مزیدار پاستا آرڈر کیا,ہم نے مزیدار پاستا ریستوران میں آرڈر کیا
correct: مینیجر نے رپورٹ پڑھا مکمل,مینیجر نے مکمل رپورٹ پڑھی
correct: ہم نے ناران کی وادی میں دریا کے کنارے بہت پرسکون وقت گزارا,ہم نے ناران کی وادی میں دریا کے کنارے پرسکون وقت گزارا
correct: پاکستان کی معیشت بہتر ہو رہی ہیں,پاکستان کی معیشت بہتر ہو رہی ہے
correct: میں میں آپ سے ملاقات کے لیے آیا ہوں,میں آپ سے ملاقات کے لیے آیا ہوں
correct: ابو نے مجھے پیسے دیا خرچ کے لیے,ابو نے مجھے خرچ کے لیے پیسے دیے
correct: وہ ہر رات سونے سے پہلے موبائل اپنا چیک کرتا ہے,وہ ہر رات سونے سے پہلے اپنا موبائل چیک کرتا ہے
correct: ڈاکٹر نے مریض کو فوری دوا دی,ڈاکٹر نے فوری دوا مریض کو دی
correct: میں نے سالن کھایا اور پیٹ میں سکون ملا فوراً,میں نے سالن کھایا اور فوراً پیٹ میں سکون ملا
correct: اس نے برگر کھایا اور برگر کھایا,اس نے برگر کھایا
correct: بار نے اس بی کیو کے لیے چکن میرینیٹ کیا,اس نے بار بی کیو کے لیے چکن میرینیٹ کیا
correct: طلبہ نے کیا بحث گروپ میں,طلبہ نے گروپ میں بحث کی
correct: میونسپلٹی نے شہر میں صفائی مہم کا آغاز کیا کیا,میونسپلٹی نے شہر میں صفائی مہم کا آغاز کیا
correct: وہ میرا پرانا دوست ہیں,وہ میرا پرانا دوست ہے
correct: کلاسیں شروع ہونے رہے تھے سے پہلے بچے کھیل,کلاسیں شروع ہونے سے پہلے بچے کھیل رہے تھے
correct: حکومت نے بجلی کے نرخوں میں کمی کا اعلان کیا کیا,حکومت نے بجلی کے نرخوں میں کمی کا اعلان کیا
correct: ہم نے صحت کے بارے میں معلومات حاصل کیا,ہم نے صحت کے بارے میں معلومات حاصل کیں
correct: حزب اختلاف نے حکومتی پالیسی پر تنقید,حزب اختلاف نے حکومتی پالیسی پر تنقید کی
correct: موبائل کی کی سکرین بہت روشن اور واضح ہے,موبائل کی سکرین بہت روشن اور واضح ہے
correct: میرے ماموں ہمارے گھر کا گھر سے دور نہیں ہے,میرے ماموں کا گھر ہمارے گھر سے دور نہیں ہے
correct: ہم نے ایک کلاسیکی موسیقی کا پروگرام سنا جو بہت پرسکون تھا,ہم نے ایک کلاسیکی موسیقی کا پروگرام سنا جو پرسکون تھا
correct: گلوکار نے اپنی آواز سامعین متاثر کیا,گلوکار نے اپنی آواز سے سامعین کو متاثر کیا
correct: میں نے پڑھا کتاب مکمل,میں نے کتاب مکمل پڑھی
correct: میری دادی نے مجھے دعا دی اور برکت دی,میری دادی نے مجھے دعا دی
correct: طلبہ نے گروپ ڈسکشن بڑھ چڑھ کر حصہ لیا,طلبہ نے گروپ ڈسکشن میں بڑھ چڑھ کر حصہ لیا
correct: میں نے پراٹھا کھایا ناشتہ میں ناشتہ میں,میں نے ناشتہ میں پراٹھا کھایا
correct: ابو نے کھانا کھایا اور کھانا تناول کیا,ابو نے کھانا کھایا
correct: وہ صبح مسجد سے واپس پڑھتا ہے آ کر قرآن,وہ صبح مسجد سے واپس آ کر قرآن پڑھتا ہے
correct: وادی کیلاش کی ثقافت بہت منفرد اور دلچسپ دلچسپ تھی,وادی کیلاش کی ثقافت بہت منفرد اور دلچسپ تھی
correct: میں نے حل کیے سوالات پریکٹس کے لیے,میں نے پریکٹس کے لیے سوالات حل کیے
correct: مینیجر نے ہدایت دی ٹیم کو,مینیجر نے ٹیم کو ہدایت دی
correct: وادی سوات میں چیری کے باغات دیکھنے کے قابل تھی,وادی سوات میں چیری کے باغات دیکھنے کے قابل تھے
correct: چپلی کباب پشاور کی ڈش ہے مشہور,چپلی کباب پشاور کی مشہور ڈش ہے
correct: یہ تحقیق انسانی جسم کو سمجھنے میں مدد دیتی دیتی ہے,یہ تحقیق انسانی جسم کو سمجھنے میں مدد دیتی ہے
correct: میں نے ایک مزاحیہ ڈراما دیکھی,میں نے ایک مزاحیہ ڈراما دیکھا
correct: تھانے میں مقدمہ درج کر گیا ہے لیا,تھانے میں مقدمہ درج کر لیا گیا ہے
correct: ہاکیہ ٹیم نے فائنل میں جگہ بنا لی,ہاکی ٹیم نے فائنل میں جگہ بنا لی
correct: میں نے دوست سے بات کیا اور ملا,میں نے دوست سے بات کی اور ملا
correct: اس نے رکھا ہاتھ کندھے پر میرے,اس نے میرے کندھے پر ہاتھ رکھا
correct: وہ میٹنگ میں بات کر رہی تھے,وہ میٹنگ میں بات کر رہی تھی
correct: پروڈکشن ٹیم نے نئے پراڈکٹ کا پہلا نمونہ تیار کیہا,پروڈکشن ٹیم نے نئے پراڈکٹ کا پہلا نمونہ تیار کیا
correct: کرکٹر مدد کی نے سینچری بنا کر میچ جتوانے میں,کرکٹر نے سینچری بنا کر میچ جتوانے میں مدد کی
correct: گھر واپس پہنچا دیر سے میں,میں گھر دیر سے واپس پہنچا
correct: نئی فلم نے باکس آفس پر ریکارڈ بزنس کی,نئی فلم نے باکس آفس پر ریکارڈ بزنس کیا
correct: ہم نے رات کو چاند دیکھا چھت پر,ہم نے رات کو چھت پر چاند دیکھا
correct: کیمسٹری کے استاد نے دوری سے سمجھایا جدول کو تفصیل,کیمسٹری کے استاد نے دوری جدول کو تفصیل سے سمجھایا
correct: بھارت نے لگائی پابندی,بھارت نے پابندی لگائی
correct: حکومت نے بجلی کے نرخوں میں کمی کا اعلان اعلان کیا,حکومت نے بجلی کے نرخوں میں کمی کا اعلان کیا
correct: پھلوں کا کا رس پینے میں بہت تازگی محسوس ہوتی ہے,پھلوں کا رس پینے میں بہت تازگی محسوس ہوتی ہے
correct: پالک پنیر کھانے بہت لذیذ تھی,پالک پنیر کھانے میں بہت لذیذ تھی
correct: ڈاکٹر نے دوا دی مریض کو فوراً اور بہتر کرنے کے لیے,ڈاکٹر نے مریض کو فوراً بہتر کرنے کے لیے دوا دی
correct: ہم نے رات دیر تک فلم دیکھی کل,ہم نے کل رات دیر تک فلم دیکھی
correct: ٹورسٹ بس نے کے شہر ہمیں مشہور مقامات دکھائے,ٹورسٹ بس نے ہمیں شہر کے مشہور مقامات دکھائے
correct: بچے نے تصویر کو کر اپنی امی بنا دکھائی,بچے نے تصویر بنا کر اپنی امی کو دکھائی
correct: وہ پہاڑوں کی چوٹی چوٹی تک ٹریکنگ کر کے گیا,وہ پہاڑوں کی چوٹی تک ٹریکنگ کر کے گیا
correct: اسلام آباد سے لاہور تک موٹر وے کا سفر بہت آرام دہ تھی,اسلام آباد سے لاہور تک موٹر وے کا سفر بہت آرام دہ تھا
correct: ہم نے ڈیٹا کا تجزیہ کیا تھا اور پھر ہم نے اس کی بنیاد پر فیصلہ کیا تھا,ہم نے ڈیٹا کا تجزیہ کیا اور اس کی بنیاد پر فیصلہ کیا
correct: صارفین خریداری کے بعد رسید ضرور لینی چاہیے,صارفین کو خریداری کے بعد رسید ضرور لینی چاہیے
correct: ایچ آر نے نئے ملازمین اہتمام ٹریننگ کا کی کیا,ایچ آر نے نئے ملازمین کی ٹریننگ کا اہتمام کیا
correct: ہم نے آن لائن شاپنگ ویب سائٹ سے سے کتابیں منگوائیں,ہم نے آن لائن شاپنگ ویب سائٹ سے کتابیں منگوائیں
correct: وہ روتا رہا اور آنسو بہاتا رہا,وہ روتا رہا
correct: ہم ہم نے اجازت حاصل کی,ہم نے اجازت حاصل کی
correct: میں نے درخواست جمع کر دیا,میں نے درخواست جمع کر دی
correct: نمائش میں آئے تھے فنکار مختلف شہروں سے,نمائش میں مختلف شہروں سے فنکار آئے تھے
correct: ڈاکٹر صاحب مجھے پچھلے چند دنوں سے بخار ہے اور میں خود کو کمزور محسوس کر رہا ہوں بہت,ڈاکٹر صاحب، مجھے پچھلے چند دنوں سے بخار ہے اور میں خود کو بہت کمزور محسوس کر رہا ہوں
correct: ملازمین نے نئے ضابطوں کو سمجھنے کی کوشش کی کوشش کی,ملازمین نے نئے ضابطوں کو سمجھنے کی کوشش کی
correct: میں نے ریسرچ پیپر لکھا تھا اور پھر میں نے اسے پروفیسر کو بھیجا تھا review کے لیے,میں نے ریسرچ پیپر لکھا اور اسے review کے لیے پروفیسر کو بھیجا
correct: میرا بہن شادی کرنے والی ہیں,میری بہن شادی کرنے والی ہے
correct: کمپنی نے سالانہ کر دیا جائزہ میٹنگ کا اعلان,کمپنی نے سالانہ جائزہ میٹنگ کا اعلان کر دیا
correct: اولمپکس کھلاڑیوں نے شاندار کارکردگی دکھائی,اولمپکس میں کھلاڑیوں نے شاندار کارکردگی دکھائی
correct: اسکور بنایا ٹیم نے اچھا پہلے اننگز میں,ٹیم نے پہلے اننگز میں اچھا اسکور بنایا
correct: ہم نے گروپ پراجیکٹ بنایا تھا اور وہ بہت difficult تھا لیکن ہم نے اسے complete کیا تھا آخر میں,ہم نے گروپ پراجیکٹ بنایا جو بہت difficult تھا لیکن آخر میں ہم نے اسے complete کیا
correct: پولیس منشیات فروشوں کے خلاف کارروائی کی,پولیس نے منشیات فروشوں کے خلاف کارروائی کی
correct: کل رات بجلی چلی گئ,کل رات بجلی چلی گئی
correct: ابو کل بازار سے پھل لائے تازہ,ابو کل بازار سے تازہ پھل لائے
correct: اس نے مجھے بتایا کہ وہ بمار ہے,اس نے مجھے بتایا کہ وہ بیمار ہے
correct: ہم نے کل کلاسیکی موسیقی سنے,ہم نے کل کلاسیکی موسیقی سنی
correct: چکن کڑاہی ساتھ خمیری روٹی بہترین تھی,چکن کڑاہی کے ساتھ خمیری روٹی بہترین تھی
correct: دوڑ لگائی لمبی بھائی نے میدان میں,بھائی نے میدان میں لمبی دوڑ لگائی
correct: کھلاری نے اچھا کھیلا,کھلاڑی نے اچھا کھیلا
correct: عالمی سطح پر مہنگائی بڑھ رہی ہیں,عالمی سطح پر مہنگائی بڑھ رہی ہے
correct: بچوں نے دوپہر اپنا ہوم ورک مکمل کر لیا,بچوں نے دوپہر میں اپنا ہوم ورک مکمل کر لیا
correct: وہ لڑکی بہت ذہین ہے اور محنتی ہے وہ لوگ,وہ لڑکی بہت ذہین اور محنتی ہے
correct: ہم نے جھیل کے پانی میں نہانے کا بہت زیادہ مزہ لیا,ہم نے جھیل کے پانی میں نہانے کا مزہ لیا
correct: مقابلے میں شرکت کے کل ٹیم لیے روانہ ہوگی,مقابلے میں شرکت کے لیے ٹیم کل روانہ ہوگی
correct: والي بال کھیلتے ہیں,والی بال کھیلتے ہیں
correct: ہم نے دفتر کو اطلاع کیا,ہم نے دفتر کو اطلاع دی
correct: یہ موبائل فون بہترین رکھتا ہے بیٹری لائف,یہ موبائل فون بہترین بیٹری لائف رکھتا ہے
correct: گاہک نے وقت ڈیلیوری نہ ہونے پر شکایت کی,گاہک نے وقت پر ڈیلیوری نہ ہونے پر شکایت کی
correct: حیاتیات کی کلاس خلیے کی ساخت پڑھائی گئی,حیاتیات کی کلاس میں خلیے کی ساخت پڑھائی گئی
correct: وہ چائے پیتا ہیں روزانہ,وہ چائے پیتا ہے روزانہ
correct: میں نے سنا وہ آنے والا ہے کل یہاں,میں نے سنا کہ وہ کل یہاں آنے والا ہے
correct: حکومت نے اہم قدم اٹھایا ہے جو کہ درست تھا,حکومت نے اہم قدم اٹھایا ہے
correct: یونیورسٹی نے تحقیقی منصوبوں کے لیاے فنڈز جاری کیے,یونیورسٹی نے تحقیقی منصوبوں کے لیے فنڈز جاری کیے
correct: وہ ہر دن رپورٹ جمع کرتے ہیں ہے,وہ ہر دن رپورٹ جمع کرتے ہیں
correct: بریانی کا ذائقہ بہت شاندار تھی,بریانی کا ذائقہ بہت شاندار تھا
correct: محکمہ تعلیم نے نئے امتحانی امتحانی شیڈول کا اعلان کیا,محکمہ تعلیم نے نئے امتحانی شیڈول کا اعلان کیا
correct: پتنگ بازی کے مقابلے میں شرکت کی سینکڑوں لوگوں نے,پتنگ بازی کے مقابلے میں سینکڑوں لوگوں نے شرکت کی
correct: میں نے گھر کا کام کیا اور گھریلو کام نمٹایا,میں نے گھر کا کام کیا
correct: وہ آیا گھر دیر,وہ گھر دیر سے آیا
correct: گلوکار نے اپنی آواز سے پورے ہال کو مسحور کر دیا,گلوکار نے اپنی سریلی آواز سے پورے ہال کو مسحور کر دیا
correct: میں نے آج صبح بہت اچہی چائے پی,میں نے آج صبح بہت اچھی چائے پی
correct: گائیڈ نے ہمیں قدیم تاریخی قلعے کی مکمل اور تفصیلی تاریخ بتائی,گائیڈ نے ہمیں قدیم قلعے کی تفصیلی تاریخ بتائی
correct: ایڈمن آفس نے فیس جمع کرانے بڑھا دی کی آخری تاریخ,ایڈمن آفس نے فیس جمع کرانے کی آخری تاریخ بڑھا دی
correct: بچوں نے کہیلنا شروع کیا,بچوں نے کھیلنا شروع کیا
correct: میری بہن نے کام کیا اور محنت کی,میری بہن نے محنت سے کام کیا
correct: میراتھن دوڑ میں پانچ سو کھلاڑیوں نے حصہ لیہا,میراتھن دوڑ میں پانچ سو کھلاڑیوں نے حصہ لیا
correct: ہم نے کل کام شروع کیا ہے تھا,ہم نے کل کام شروع کیا تھا
correct: تیز مصالحے والے کھانے کے بعد ٹھنڈی ٹھنڈی لسی بہت اچھی لگی,تیز مصالحے والے کھانے کے بعد ٹھنڈی لسی بہت اچھی لگی
correct: ہم نے سیر کی پارک صبح,ہم نے صبح پارک میں سیر کی
correct: آج کا دن خوشگوار ہے بہت,آج کا دن بہت خوشگوار ہے
correct: موبائل کی سکرین بہت روشن اور واضح ہیں,موبائل کی سکرین بہت روشن اور واضح ہے
correct: میری دوست کرکٹ کھیلتا ہے,میری دوست کرکٹ کھیلتی ہے
correct: سردیوں میں گاجر ضرور حلوہ کا کھانا چاہیے,سردیوں میں گاجر کا حلوہ ضرور کھانا چاہیے
correct: سیر نے تاریخی مقامات کی سیاحوں کی,سیاحوں نے تاریخی مقامات کی سیر کی
correct: FAST میں اساتذہ نے پڑھایا پڑھایا,FAST میں اساتذہ نے پڑھایا
correct: سوز کر دیا خوانی کی محفل نے روح کو معطر,سوز خوانی کی محفل نے روح کو معطر کر دیا
correct: رات کو بجلی جانے کی وجہ سے پنکھا بند ہو گئی,رات کو بجلی جانے کی وجہ سے پنکھا بند ہو گیا
correct: یہ فلم بہت بہت زیادہ تکنیکی اور فنی لحاظ سے مضبوط اور متاثر کن ہے,یہ فلم تکنیکی اور فنی لحاظ سے مضبوط اور متاثر کن ہے
correct: فلسطین میں تشدد بڑھ رہی ہیں,فلسطین میں تشدد بڑھ رہا ہے
correct: میں نے صبح اخبار پڑھا چائے کے ساتھ بیٹھ کر,میں نے صبح چائے کے ساتھ بیٹھ کر اخبار پڑھا
correct: بس کا سفر آرام دہ اور محفوظ محفوظ رہا,بس کا سفر آرام دہ اور محفوظ رہا
correct: آرٹ گیلری میں موجود تمام تمام جدید پینٹنگز نہایت خوبصورت تھیں,آرٹ گیلری میں موجود جدید پینٹنگز نہایت خوبصورت تھیں
correct: کلاسیکل موسیقی کی محفل کا انعقاد مقامی ہوٹل ہوا,کلاسیکل موسیقی کی محفل کا انعقاد مقامی ہوٹل میں ہوا
correct: اسٹیڈیم میں ہزاروں ہزاروں شائقین نے میچ دیکھا,اسٹیڈیم میں ہزاروں شائقین نے میچ دیکھا
correct: میں روزانہ دو گھنٹے مشق کی ریاضی کرتا ہوں,میں روزانہ دو گھنٹے ریاضی کی مشق کرتا ہوں
correct: کمپنی نے سالانہ جائزہ میٹنگ کا کا اعلان کر دیا,کمپنی نے سالانہ جائزہ میٹنگ کا اعلان کر دیا
correct: لاہور میں ہوا بڑا سیاسی جلسہ,لاہور میں بڑا سیاسی جلسہ ہوا
correct: میں نے لیکچر میں سوال پوچھا اور استاد نے جواب دیے,میں نے لیکچر میں سوال پوچھا اور استاد نے جواب دیا
correct: ہم نے پیزا کھایا رات کو,ہم نے رات کو پیزا کھایا
correct: ہم نے دیکھی ویڈیو اور سمجھا جسم کا نظام کیسے چلتا ہے,ہم نے ویڈیو دیکھی اور سمجھا کہ جسم کا نظام کیسے چلتا ہے
correct: روس نے حملہ کیا ہیں,روس نے حملہ کیا ہے
correct: میں ادبی کتاب بہت دلچسپ پڑھی,میں نے ایک ادبی کتاب بہت دلچسپ پڑھی
correct: کھلاڑی بہت اچھا کھیلتا ہیں,کھلاڑی بہت اچھا کھیلتا ہے
correct: ٹیم نے پراجیکٹ کی کامیابی کے بعد جشن دفتر میں منایا,ٹیم نے پراجیکٹ کی کامیابی کے بعد دفتر میں جشن منایا
correct: ہم نے چھٹیاں گزارنے کے لیے ناران کا انتخاب کیہا,ہم نے چھٹیاں گزارنے کے لیے ناران کا انتخاب کیا
correct: وہ وہ اکثر موبائل موبائل استعمال کرتا ہے,وہ اکثر موبائل استعمال کرتا ہے
correct: ہم پارک گئے تھے اور وہاں بچوں نے بہت کھیل کھیلا تھا خوش ہو کر,ہم پارک گئے اور وہاں بچوں نے خوشی سے بہت کھیل کھیلا
correct: محکمہ تعلیم نے نئے امتحانی شیڈول کا اعلان کیا کیا,محکمہ تعلیم نے نئے امتحانی شیڈول کا اعلان کیا
correct: صدر نے قومی خطاب کیا اسمبلی سے,صدر نے قومی اسمبلی سے خطاب کیا
