input,output
correct: گلوکار نے اپنی اپنی دھن سے سب کو متاثر کیا,گلوکار نے اپنی دھن سے سب کو متاثر کیا
correct: گائیڈ نے ہمیں تاریخی مقامات کی مکمل اور تفصیلی سیر کرائی,گائیڈ نے ہمیں تاریخی مقامات کی سیر کرائی
correct: دکان میں دستیاب ہے ہر قسم کا برقی سامان,دکان میں ہر قسم کا برقی سامان دستیاب ہے
correct: ہم نے ریسرچ کی کی,ہم نے ریسرچ کی
correct: چھوٹی بچی نے اپنی گڑیا کو کپڑے کپڑے پہنائے,چھوٹی بچی نے اپنی گڑیا کو کپڑے پہنائے
correct: ہم نے گزشتہ سہ ماہی کے نتائج کا تجزیہ کیہا,ہم نے گزشتہ سہ ماہی کے نتائج کا تجزیہ کیا
correct: ہم نے سیکھا انسانی جسم کا نظام کلاس میں,ہم نے کلاس میں انسانی جسم کا نظام سیکھا
correct: بلے باز نے خوبصورت شاٹ کھیلا جو سب نے سراہا,بلے باز نے خوبصورت شاٹ کھیلا
correct: ٹیم نے ٹریننگ مکمل کی نئے ملازمین,ٹیم نے نئے ملازمین کی ٹریننگ مکمل کی
correct: لگیں دھنکیاں غلطی پر کھلاڑی کو,کھلاڑی کو غلطی پر دھنکیاں لگیں
correct: میں نے دھویا برتن کھانے کے بعد,میں نے کھانے کے بعد برتن دھوئے
correct: جسم میں خون گردش کرتا پورے,جسم میں خون پورے جسم میں گردش کرتا ہے
correct: میں نے پراجیکٹ بنایا اور بنایا,میں نے پراجیکٹ بنایا
correct: ہو رہی ہے ٹریننگ,ٹریننگ ہو رہی ہے
correct: پڑھائی میں مستقل مزاجی کامیابی کی کنجی ہیں,پڑھائی میں مستقل مزاجی کامیابی کی کنجی ہے
correct: وزیر صحت نے ہسپتالوں میں ادویات کی قلت دور کرنے کی یقین دہانی کرایا,وزیر صحت نے ہسپتالوں میں ادویات کی قلت دور کرنے کی یقین دہانی کرائی
correct: میں نے اس کو فون کریا,میں نے اسے فون کیا
correct: گھر میں کھانا ہے کوئی نہیں آج,آج گھر میں کوئی کھانا نہیں ہے
correct: ہم نے AI کورس میں کوڈ لکھا تھا اور پھر ہم نے اس کو improve بھی کیا تھا بار بار,ہم نے AI کورس میں کوڈ لکھا اور اسے بار بار improve کیا
correct: تفریحی مقام پر رش تھا بہت زیادہ,تفریحی مقام پر بہت زیادہ رش تھا
correct: بھابہی نے صحن میں رنگولی بنائی,بھابھی نے صحن میں رنگولی بنائی
correct: کلاسیکل موسیقی کی محفل کر سامعین کو مسحور نے دیا,کلاسیکل موسیقی کی محفل نے سامعین کو مسحور کر دیا
correct: بھائی نے کر دھو گاڑی صاف کر دی,بھائی نے گاڑی دھو کر صاف کر دی
correct: میں نے نوٹس کو آرگنائز کیا,میں نے نوٹس کو ارگنائز کیا
correct: ہم نے کل کل پروجیکٹ شروع کیا,ہم نے کل پروجیکٹ شروع کیا
correct: مریض کو آرام مکمل دیا گیا اسپتال,مریض کو اسپتال میں مکمل آرام دیا گیا
correct: فنانس ڈیپارٹمنٹ نے رپورٹ بنا رہے ہیں,فنانس ڈیپارٹمنٹ رپورٹ بنا رہا ہے
correct: صارفین کو شکایت درج کروانے کے گئی ہیلپ لائن دی لیے ہے,صارفین کو شکایت درج کروانے کے لیے ہیلپ لائن دی گئی ہے
correct: میں میں نے آج آج پانی بہت پیا,میں نے آج پانی بہت پیا
correct: آرٹ گیلری نمائش لگی میں نوجوان مصور کی,آرٹ گیلری میں نوجوان مصور کی نمائش لگی
correct: میں نے صبح پانی پیا خالی پیٹ,میں نے صبح خالی پیٹ پانی پیا
correct: ہم نے ہم نے پارک میں چہل چہل کی,ہم نے پارک میں چہل کی
correct: لذیذ کا شیک پینے میں بہت آمد تھا,آمد کا شیک پینے میں بہت لذیذ تھا
correct: گائیڈ نے ہمیں قدیم قلعہ دکھائی,گائیڈ نے ہمیں قدیم قلعہ دکھایا
correct: ہم گئے پارک شام,ہم شام کو پارک گئے
correct: بچے نے چاکلیٹ خوشی سے فوری کھائی,بچے نے خوشی سے چاکلیٹ فوری کھائی
correct: وہ ہر روز صبح اٹهتی ہے جلدی,وہ ہر روز صبح جلدی اٹھتی ہے
correct: کی نے نئے پراڈکٹ صارفین تعریف کی,صارفین نے نئے پراڈکٹ کی تعریف کی
correct: میں نے پھل کھائے تازہ,میں نے تازہ پھل کھائے
correct: ابو صبح سویرے اٹھ کر فجر کی نماز پڑھتے ہے,ابو صبح سویرے اٹھ کر فجر کی نماز پڑھتے ہیں
correct: ان کا گھر بہت پرانی ہے,ان کا گھر بہت پرانا ہے
correct: وہ میرا دوست ہے اور میرا ساتھی ہے,وہ میرا دوست ہے
correct: ایڈمن آفس نے فیس فیس جمع کرانے کی آخری تاریخ بڑھا دی,ایڈمن آفس نے فیس جمع کرانے کی آخری تاریخ بڑھا دی
correct بچے گلی میں کریکنٹ کھیل رہے تھے اور بہت شور کر رہے تھے جو مزے کا تھا,بچے گلی میں کریکنٹ کھیل رہے تھے اور بہت شور مچا رہے تھے
correct: مصنف نے لکھی کتاب نوجوانوں کی مشکلات پر,مصنف نے نوجوانوں کی مشکلات پر کتاب لکھی
correct: ہم نے ناران کی وادی میں دریا کا منظہر دیکھا,ہم نے ناران کی وادی میں دریا کا منظر دیکھا
correct: ہوئیئی جہاز نے وقت پر پرواز بھری,ہوائی جہاز نے وقت پر پرواز بھری
correct: عید کے موقع پر خصوصی ڈرامہ پیش کیہا گیا,عید کے موقع پر خصوصی ڈرامہ پیش کیا گیا
correct: میری بھائی کرکٹ کھیلتا ہے,میرا بھائی کرکٹ کھیلتا ہے
correct: جنریٹو اے آئی میں اسائنمنٹ دیا دیا گیا,جنریٹو اے آئی میں اسائنمنٹ دیا گیا
correct: بہت مشین کو چلانے کا طریقہ اس آسان ہے,اس مشین کو چلانے کا طریقہ بہت آسان ہے
correct: ٹی وی چینل نے نیا نیا تفریحی شو شروع کیا,ٹی وی چینل نے نیا تفریحی شو شروع کیا
correct: ٹینس نام کیا کھلاڑی نے مقابلہ جیت کر ٹائٹل اپنے,ٹینس کھلاڑی نے مقابلہ جیت کر ٹائٹل اپنے نام کیا
correct: گائیڈ نے ہمیں قلعے کے بارے میں بتایا تھا تفصیل سے,گائیڈ نے ہمیں قلعے کے بارے میں تفصیل سے بتایا
correct: نوجوان ہدایت کار نے فلم بنائی مختصر,نوجوان ہدایت کار نے مختصر فلم بنائی
correct: ہم نے پڑھا کتاب اور سمجھا جسم کیسے کام کرتا ہے,ہم نے کتاب پڑھی اور سمجھا کہ جسم کیسے کام کرتا ہے
correct: چھوٹی بچیاں نے اپنی گڑیا کو کپڑے پہنائے,چھوٹی بچی نے اپنی گڑیا کو کپڑے پہنائے
correct: آج میں نے بہت مصروف دن گزارا کام کے ساتھ,آج میں نے کام کے ساتھ بہت مصروف دن گزارا
correct: ہم نے جنریٹو اے آئی میں ماڈل بنایا تھا اور پھر ہم نے اسے deploy بھی کیا تھا successfully,ہم نے جنریٹو اے آئی میں ماڈل بنایا اور اسے successfully deploy کیا
correct: محکمہ بارش نے موسمیات کی پیشگوئی کر دی,محکمہ موسمیات نے بارش کی پیشگوئی کر دی
correct: گائیڈ نے ہمیں قلعے کی تاریخ تاریخ بتائی,گائیڈ نے ہمیں قلعے کی تاریخ بتائی
correct: گاہک نے پراڈکٹ کے رائے میں بارے دی,گاہک نے پراڈکٹ کے بارے میں رائے دی
correct: یہ بیماری جلدی پھیلتے ہیں,یہ بیماری جلدی پھیلتی ہے
correct: مریض نے دوائی وقت پر لیا,مریض نے دوائی وقت پر لی
correct: میں نے اسکالرشپ کے کرا درخواست جمع لیے دی ہے,میں نے اسکالرشپ کے لیے درخواست جمع کرا دی ہے
correct: باہر بیٹھے تھے سب رات کو چھت پر,سب رات کو چھت پر باہر بیٹھے تھے
correct: ملکی معیشت ہو بہتری کے آثار نمایاں میں رہے ہیں,ملکی معیشت میں بہتری کے آثار نمایاں ہو رہے ہیں
correct: میں نے کیمپ لگا کر رات پہاڑوں ہم گزاری,ہم نے کیمپ لگا کر رات پہاڑوں میں گزاری
correct: ہم تھیٹر ایک مزاحیہ ڈراما دیکھا,ہم نے تھیٹر میں ایک مزاحیہ ڈراما دیکھا
correct: اس نے توڑا ریکارڈ دوڑ میں سو میٹر,اس نے سو میٹر دوڑ میں ریکارڈ توڑا
correct: کھلاڑی روزانہ پریکٹس گھنٹے چار کرتا ہے,کھلاڑی روزانہ چار گھنٹے پریکٹس کرتا ہے
correct: ابو نے کار پر رکھی کی چابی میز,ابو نے کار کی چابی میز پر رکھی
correct: میرا بھائی سکول گیا ہے آج سکول پہنچا ہے,میرا بھائی آج سکول گیا ہے
correct: میں نے جنریٹو اے آئی میں اسائنمنٹ کیا کیا,میں نے جنریٹو اے آئی میں اسائنمنٹ کیا
correct: وہ وہ کل کل بہت دیر سے آیا,وہ کل بہت دیر سے آیا
correct: سفارت خانے نے نے ویزا کی درخواست منظور کر لی,سفارت خانے نے ویزا کی درخواست منظور کر لی
correct: سردیوں میں گاجر کا حلوہ ضرور ضرور کھانا چاہیے,سردیوں میں گاجر کا حلوہ ضرور کھانا چاہیے
correct: عدالت نے مقدمے کی کی اگلی تاریخ مقرر کر دی,عدالت نے مقدمے کی اگلی تاریخ مقرر کر دی
correct: ہمارے گھر کے باہر نیم نیم کا درخت ہے,ہمارے گھر کے باہر نیم کا درخت ہے
correct: پہلوان نے کشتی کے مقابلے میں جیت حاصل,پہلوان نے کشتی کے مقابلے میں جیت حاصل کی
correct: ابو نے مجے پیسے دیے,ابو نے مجھے پیسے دیے
correct: مینیجر صبح آج نے ٹیم میٹنگ بلائی,مینیجر نے آج صبح ٹیم میٹنگ بلائی
correct: رات کو بجلی جانے کی کی وجہ سے پنکھا بند ہو گیا,رات کو بجلی جانے کی وجہ سے پنکھا بند ہو گیا
correct: مقابلے میں روانہ کے لیے ٹیم کل شرکت ہوگی,مقابلے میں شرکت کے لیے ٹیم کل روانہ ہوگی
correct: شاعر نے مشاعرے میں اپنی تازہ ترین غزل سنایا,شاعر نے مشاعرے میں اپنی تازہ ترین غزل سنائی
correct: چھوٹی بہن نے اپنے کمرے صفائی خود کی,چھوٹی بہن نے اپنے کمرے کی صفائی خود کی
correct: مینیجر نے نے رپورٹ کا جائزہ لیا,مینیجر نے رپورٹ کا جائزہ لیا
correct: ہم نے فائل مینیجر جمع کرائی,ہم نے فائل مینیجر کو جمع کرائی
correct: آپ کی درخواست پر غور غور کیا جا رہا ہے,آپ کی درخواست پر غور کیا جا رہا ہے
correct: آن لائن آرڈر آرڈر کرنے پر مفت ڈیلیوری کی سہولت ہے,آن لائن آرڈر کرنے پر مفت ڈیلیوری کی سہولت ہے
correct: کلاسیں شروع ہونے سے رہے تھے پہلے بچے کھیل,کلاسیں شروع ہونے سے پہلے بچے کھیل رہے تھے
correct: معروف ادیب کی نئی کتاب منظر عام عام پر آ گئی,معروف ادیب کی نئی کتاب منظر عام پر آ گئی
correct: آمد کا لذیذ پینے میں بہت شیک تھا,آمد کا شیک پینے میں بہت لذیذ تھا
correct: ہم نے ہوٹل میں کھانا کھایا کھانا,ہم نے ہوٹل میں کھانا کھایا
correct: میں نے اسے پانی دیا وہ پیاسا تھی,میں نے اسے پانی دیا وہ پیاسا تھا
correct: رپورٹ کو میں نے جلدی مکمل کیا آج صبح,میں نے آج صبح رپورٹ جلدی مکمل کی
correct: ہم نے سیر کی صبح پارک,ہم نے صبح پارک میں سیر کی
correct: امی نے عید میٹھی سویاں پکائیں,امی نے عید پر میٹھی سویاں پکائیں
correct: ہوا سیلاب شدید پنجاب کے علاقوں میں,پنجاب کے علاقوں میں شدید سیلاب ہوا
correct: میں نے AI پراجیکٹ بنایا بنایا,میں نے AI پراجیکٹ بنایا
correct: طلبہ نے سائنس فیئر میں مختلف پیش کیے پراجیکٹس,طلبہ نے سائنس فیئر میں مختلف پراجیکٹس پیش کیے
correct: ہوٹل کے کھانے میں مصالحہ تیز تھا بہت,ہوٹل کے کھانے میں مصالحہ بہت تیز تھا
correct: وہ پہاڑوں کی چوٹی تک کے گیا ٹریکنگ کر,وہ پہاڑوں کی چوٹی تک ٹریکنگ کر کے گیا
correct: ابو کا مزاج آج ٹھیک نہیں ہیں,ابو کا مزاج آج ٹھیک نہیں ہے
correct: معروف ادیب کی کی نئی کتاب منظر عام پر آ گئی,معروف ادیب کی نئی کتاب منظر عام پر آ گئی
correct: وہ پہنچ گیا وقت پر شادی میں,وہ شادی میں وقت پر پہنچ گیا
correct: بہن نے شام کی چائے چائے کے ساتھ سموسے بنائے,بہن نے شام کی چائے کے ساتھ سموسے بنائے
correct: گاہک خراب سامان واپس کرنے کی درخواست کی,گاہک نے خراب سامان واپس کرنے کی درخواست کی
correct: میرا پسندیدہ رنگ ہے نیلا بہت,نیلا رنگ مجھے بہت پسند ہے
correct: پھلوں کا رس پینے محسوس بہت تازگی میں ہوتی ہے,پھلوں کا رس پینے میں بہت تازگی محسوس ہوتی ہے
correct: قلعہ روہتاس کی دیواروں پر پرانے دور لکھائی تھی,قلعہ روہتاس کی دیواروں پر پرانے دور کی لکھائی تھی
correct: شاعرہ نے اپنی اپنی غزل کو نہایت خوبصورتی سے پیش کیا,شاعرہ نے اپنی غزل کو نہایت خوبصورتی سے پیش کیا
correct: ہوٹل میں کھانے کے مصالحہ بہت تیز تھا,ہوٹل کے کھانے میں مصالحہ بہت تیز تھا
correct: ہم نے تھیٹر میں ایک ایک نیا اسٹیج ڈراما دیکھا,ہم نے تھیٹر میں ایک نیا اسٹیج ڈراما دیکھا
correct: ہم نے سموسہ اور پکوڑا کھائی,ہم نے سموسے اور پکوڑے کھائے
correct: ہو رہا ہے مقابلہ دلچسپ بہت,مقابلہ بہت دلچسپ ہو رہا ہے
correct: ہم نے لیب میں تجربہ کیا تھا اور اس کا نتیجہ اچھا آیا تھا,ہم نے لیب میں تجربہ کیا اور اچھا نتیجہ آیا
correct: میراتھن دوڑ میں پانچ پانچ سو کھلاڑیوں نے حصہ لیا,میراتھن دوڑ میں پانچ سو کھلاڑیوں نے حصہ لیا
correct: ہم ہم نے رپورٹ جمع کرائی,ہم نے رپورٹ جمع کرائی
correct: ہم نے دیکھا لیکچر استاد کا آن لائن,ہم نے آن لائن استاد کا لیکچر دیکھا
correct: محکمہ تعلیم نے نئے نئے امتحانی شیڈول کا اعلان کیا,محکمہ تعلیم نے نئے امتحانی شیڈول کا اعلان کیا
correct: نمائش میں رکھی گئی مجسمے بہت قیمتی تھا,نمائش میں رکھے گئے مجسمے بہت قیمتی تھے
correct: دادی اماں نے ہمیں پرانی کہانی سنایا,دادی اماں نے ہمیں پرانی کہانی سنائی
correct: فلائنگ کوچ نے اسلام آباد سے سکردو تک کا سفر آسان کر دیہا,فلائنگ کوچ نے اسلام آباد سے سکردو تک کا سفر آسان کر دیا
correct: دادی اماں نے ہمیں کہانی سنائی پرانی,دادی اماں نے ہمیں پرانی کہانی سنائی
correct: ہمارے گھر کے سامنے ایک خوبصورت خوبصورت باغ ہے,ہمارے گھر کے سامنے ایک خوبصورت باغ ہے
correct: کھانے میں دہی کا اچھا بہت رائتہ لگتا ہے,کھانے میں دہی کا رائتہ بہت اچھا لگتا ہے
correct: سیاحوں نے گلیشیئر کے نیلے پانی کا حیرت انگیز نظارہ کیا صبح کے وقت,سیاحوں نے صبح کے وقت گلیشیئر کے نیلے پانی کا حیرت انگیز نظارہ کیا
correct: وہ روزانہ شام کو پارک پارک میں سیر کرنے جاتا ہے,وہ روزانہ شام کو پارک میں سیر کرنے جاتا ہے
correct: مارکیٹنگ ٹیم نے نئی مہم کا کا آغاز کر دیا,مارکیٹنگ ٹیم نے نئی مہم کا آغاز کر دیا
correct: نمائش میں رکھی گئی تھیں خوبصورت تصویریں دیواروں پر,نمائش میں خوبصورت تصویریں دیواروں پر رکھی گئی تھیں
correct: فٹبال میچ کے بعد کھلاڑیوں نے ایک ایک دوسرے سے مصافحہ کیا,فٹبال میچ کے بعد کھلاڑیوں نے ایک دوسرے سے مصافحہ کیا
correct: کل کے کنسرٹ میں ہزاروں لوگ موجود تھا,کل کے کنسرٹ میں ہزاروں لوگ موجود تھے
correct: میرا آنکھیں بہت تھکی ہوئی ہے,میری آنکھیں بہت تھکی ہوئی ہیں
correct: وکیل نے عدالت میں بات کیا تھا,وکیل نے عدالت میں بات کی تھی
correct: کھلاڑیوں نے کی محنت بہت جیتنے کے لیے اور کامیاب ہوئے,کھلاڑیوں نے جیتنے کے لیے بہت محنت کی اور کامیاب ہوئے
correct: میں نے کام کیا اور تھکا ہوا تھا,میں نے کام کیا اور تھک گیا
correct: اس نے لایا پھول خوبصورت باغ سے,اس نے باغ سے خوبصورت پھول لائے
correct: گھر میں آج پانی کا پریشر بہت کم تہا,گھر میں آج پانی کا پریشر بہت کم تھا
correct: آپ کا گھر کہاں پر واقع ہے ہے؟,آپ کا گھر کہاں واقع ہے؟
correct: فٹ بالر نے خوبصورت خوبصورت گول کیا,فٹ بالر نے خوبصورت گول کیا
correct: کلاسیں شروع شروع ہونے سے پہلے بچے کھیل رہے تھے,کلاسیں شروع ہونے سے پہلے بچے کھیل رہے تھے
correct: سیاحوں نے پہاڑ پر چڑھ کر تصویر لیا,سیاحوں نے پہاڑ پر چڑھ کر تصویر لی
correct: کھانے لگتا ہے میں دہی کا رائتہ بہت اچھا,کھانے میں دہی کا رائتہ بہت اچھا لگتا ہے
correct: میں نے جنریٹو اے آئی کورس کیا تھا اور وہ بہت اچھا کورس تھا میرے لیے,میں نے جنریٹو اے آئی کورس کیا جو میرے لیے بہت اچھا تھا
correct: نیٹ مظاہرہ کیا بال ٹیم نے شاندار دفاع کا,نیٹ بال ٹیم نے شاندار دفاع کا مظاہرہ کیا
correct: حکومت نے لگائی پابندی,حکومت نے پابندی لگائی
correct: میں میں نے ای میل بھیج دی ہے,میں نے ای میل بھیج دی ہے
correct: بارش موسمیات نے محکمہ کی پیشگوئی کر دی,محکمہ موسمیات نے بارش کی پیشگوئی کر دی
correct: میں نے کل بہت زیادہ کام کیا تھا اور مجھے آرام کا وقت نہیں ملا تھا بالکل,میں نے کل بہت زیادہ کام کیا اور مجھے بالکل آرام کا وقت نہیں ملا
correct: امریکہ نے لگائی پابندیاں ایران پر,امریکہ نے ایران پر پابندیاں لگائیں
correct: ہم نے ہم نے دفتر کو اطلاع دی,ہم نے دفتر کو اطلاع دی
correct: تھیٹر آرٹسٹوں نے کیا پرفارمنس,تھیٹر آرٹسٹوں نے پرفارمنس کیا
correct: ہسپتال انتظامیہ نے نئی منظوری دی مشینری خریدنے کی,ہسپتال انتظامیہ نے نئی مشینری خریدنے کی منظوری دی
correct: یہ فلم ایک حقیقی واقعے پر مبنی ہے اور بہت متاثر کن ہے,یہ فلم ایک حقیقی واقعے پر مبنی اور متاثر کن ہے
correct: اولمپکس میں کھلاڑیوں کارکردگی شاندار نے دکھائی,اولمپکس میں کھلاڑیوں نے شاندار کارکردگی دکھائی
correct: بھارت نے پاکستان پر تنقید کی ہیں,بھارت نے پاکستان پر تنقید کی ہے
correct: مریض کو دوا دی گئی اور اس کو آرام آیا فوراً,مریض کو دوا دی گئی اور اسے فوراً آرام آیا
correct: سیلاب زدہ علاقوں میں جاری کارروائیاں امدادی ہیں,سیلاب زدہ علاقوں میں امدادی کارروائیاں جاری ہیں
correct: دیکھا میچ دلچسپ بہت دوست کے ساتھ,دوست کے ساتھ بہت دلچسپ میچ دیکھا
correct: یہ موبائل فون رکھتا ہے بہترین بیٹری لائف,یہ موبائل فون بہترین بیٹری لائف رکھتا ہے
correct: وہ گرمیوں میں کراچی کے ساحل گھومنے گیا,وہ گرمیوں میں کراچی کے ساحل پر گھومنے گیا
correct: نے وی چینل ٹی نیا تفریحی شو شروع کیا,ٹی وی چینل نے نیا تفریحی شو شروع کیا
correct: کارروائیاں زدہ علاقوں میں امدادی سیلاب جاری ہیں,سیلاب زدہ علاقوں میں امدادی کارروائیاں جاری ہیں
correct: وہ کپڑے استری کر کے الماری رکھتی ہے,وہ کپڑے استری کر کے الماری میں رکھتی ہے
correct: ہم نے کل نئی فلم دیکھی ہیں,ہم نے کل نئی فلم دیکھی ہے
correct: محکمہ تعلیم اعلان کیا نے نئے امتحانی شیڈول کا,محکمہ تعلیم نے نئے امتحانی شیڈول کا اعلان کیا
correct: ہمارے گھر کے باہر نیم کا درخت ہیں,ہمارے گھر کے باہر نیم کا درخت ہے
correct: کل ہم نے مل کر کھانا کھایا ساتھ بیٹھ کر,کل ہم نے مل کر کھانا کھایا
correct: ہم نے ڈیٹا ویری فائی کیا,ہم نے ڈیٹا ویریفائی کیا
correct: سیاحوں نے ساحل سمندر پر غروب آفتاب کا بہت شاندار خوبصورت نظارہ کیا,سیاحوں نے ساحل سمندر پر غروب آفتاب کا شاندار نظارہ کیا
correct: بینک میں نے شرح سود دولت اضافے کا اعلان کیا,بینک دولت نے شرح سود میں اضافے کا اعلان کیا
correct: میں نے ناشتہ کھایا اسکول,میں نے اسکول جانے سے پہلے ناشتہ کھایا
correct: وہ چلا گیا اور روانہ ہو گیا,وہ چلا گیا
correct: سیاح بس اتر کر تصاویر بنائے,سیاح بس سے اتر کر تصاویر بناتے رہے
correct: بورڈ آف منظوری نے توسیع کی ڈائریکٹرز دے دی,بورڈ آف ڈائریکٹرز نے توسیع کی منظوری دے دی
correct: امی نے مہمانوں کے لیے بریانی اور قورمہ پکائی,امی نے مہمانوں کے لیے بریانی اور قورمہ پکایا
correct: مہمانوں کے لیے قورمہ اور نان کا اہتمام کیا کیا گیا,مہمانوں کے لیے قورمہ اور نان کا اہتمام کیا گیا
correct: آج آندھی آئی اور تیز طوفان آیا,آج آندھی آئی
correct: یہ کتاب ادب کے طالب علموں کے لیے بہت مفید ثابت ہوتی ہے,یہ کتاب ادب کے طالب علموں کے لیے مفید ثابت ہوتی ہے
correct: میں نے سموسے کھایا اور خوش تھا,میں نے سموسے کھائے اور خوش تھا
